{
  "schema_version": "dataset-manifest/1",
  "source_id": "caiso-pge-c16-poi",
  "source_url": "https://www.caiso.com/documents/pg-e-information-on-points-of-interconnection-poi-availability-for-cluster-16.pdf",
  "origin": "synthetic_fixture",
  "retrieved_at": null,
  "retrieval_status": "synthetic",
  "response_status": null,
  "sha256": "7d83ffef11ba727994e7d0c8f66f587a7f0f598a3673afacad91d7e1eaae50de",
  "byte_count": 220,
  "record_count": null,
  "time_coverage": null,
  "upstream_release": null,
  "units": {},
  "transformations": [
    "hand-written synthetic data; no source data was copied"
  ],
  "limitations": [
    "SYNTHETIC: invented for deterministic tests; says nothing about the real source or any real project"
  ],
  "attribution": "Synthetic fixture authored in this repository; not source-derived, so no upstream attribution applies."
}
